{
  "$schema": "https://raw.githubusercontent.com/MaTeS72/agent-workflow-kit/main/schema/agent-workflow.schema.json",
  "stack": "flutter",
  "protected": [
    {
      "glob": "**/*.freezed.dart",
      "reason": "Generated by Freezed. Edit the source .dart file, then run `fvm dart run build_runner build --delete-conflicting-outputs`."
    },
    {
      "glob": "**/*.g.dart",
      "reason": "Generated by build_runner. Edit the source .dart file, then run `fvm dart run build_runner build --delete-conflicting-outputs`."
    },
    {
      "glob": "lib/l10n/generated/**",
      "reason": "Generated by gen-l10n. Edit the ARB files in lib/l10n/, then run `fvm flutter gen-l10n`."
    },
    {
      "glob": "lib/firebase_options.dart",
      "reason": "Generated by the FlutterFire CLI. Re-run `flutterfire configure` instead of editing it."
    },
    {
      "glob": "functions/lib/**",
      "reason": "Build output of `npm run build` in functions/ (lib/assets/ holds copies of functions/assets/). Edit functions/src or functions/assets, then rebuild."
    },
    {
      "glob": "test/fixtures/import_corpus/goldens/**",
      "reason": "Import goldens are regenerated, never hand-edited: a hand-fixed golden hides a real regression. Report the diff; the owner decides whether to run `./scripts/import_check/check.sh --update`."
    },
    {
      "glob": "test/fixtures/import_corpus/quality_baseline.json",
      "reason": "The quality baseline only moves on purpose, through `check.sh --update`, with the owner's go-ahead. Editing it by hand hides a regression."
    }
  ],
  "formatOnEdit": [
    { "glob": "**/*.dart", "command": "fvm dart format {file}" }
  ],
  "pairedFiles": [
    {
      "glob": "lib/l10n/app_*.arb",
      "reminder": "All 8 ARB files (en, cs, de, es, fr, it, nl, pl) change together. Add the key to every one, then run `fvm flutter gen-l10n`."
    },
    {
      "glob": "ios/Runner/InfoPlist.xcstrings",
      "reminder": "Every permission prompt needs all 8 languages; test/l10n/ios_info_plist_l10n_test.dart fails until they're there. Its `en` value overrides Info.plist at runtime."
    },
    {
      "glob": "pubspec.yaml",
      "reminder": "Absolute rule 4: never add a dependency without asking. If you added one, stop and ask before going further."
    },
    {
      "glob": "lib/utils/string_utils.dart",
      "reminder": "HTML entity decoding is mirrored in functions/src/html_entities.ts and ios/MeallyShareExtension/JsonLdParser.swift (decodeEntities). Change every copy, then run ./scripts/import_check/check.sh (after `npm run build` in functions/)."
    },
    {
      "glob": "functions/src/html_entities.ts",
      "reminder": "HTML entity decoding is mirrored in lib/utils/string_utils.dart and ios/MeallyShareExtension/JsonLdParser.swift (decodeEntities). Change every copy, then run ./scripts/import_check/check.sh."
    },
    {
      "glob": "lib/utils/import_naming.dart",
      "reminder": "Canonical empty-import naming. Mirrored in functions/src/extract_recipe.ts, ios/MeallyShareExtension/ExtractedRecipe.swift and android/app/src/main/kotlin/com/martincarska/mealplanner/ShareActivity.kt. Change every copy."
    },
    {
      "glob": "lib/utils/language_resolver.dart",
      "reminder": "Mirrored in functions/src/language_resolver.ts. Change both, then run ./scripts/import_check/check.sh."
    },
    {
      "glob": "lib/services/helper_services/*_extractor.dart",
      "reminder": "The app's extractors are mirrored in functions/src/extract_recipe.ts (JSON-LD picking and normalizeAliases, extractRecipeFromMicrodata, extractPrimaryContent); JSON-LD handling is also in ios/MeallyShareExtension/JsonLdParser.swift. Change every copy, then run ./scripts/import_check/check.sh."
    },
    {
      "glob": "lib/services/helper_services/ai_model_factory.dart",
      "reminder": "The model id is mirrored in AI_MODEL in functions/src/extract_recipe.ts. Change both, and only on the evidence of an eval run."
    },
    {
      "glob": "functions/src/extract_recipe.ts",
      "reminder": "Logic here is mirrored in the app (lib/services/helper_services/*_extractor.dart, lib/utils/import_naming.dart, ai_model_factory.dart) and partly in Swift (JsonLdParser.swift, ExtractedRecipe.swift) and Kotlin (ShareActivity.kt). Change every copy, then run ./scripts/import_check/check.sh."
    },
    {
      "glob": "ios/MeallyShareExtension/*.swift",
      "reminder": "The share extension mirrors app and Cloud Function logic (entity decoding, JSON-LD normalization, import naming). Change every copy, then run ./scripts/import_check/check.sh, which also runs the Swift goldens."
    },
    {
      "glob": "android/app/src/main/kotlin/com/martincarska/mealplanner/ShareActivity.kt",
      "reminder": "Import naming here mirrors lib/utils/import_naming.dart, which is canonical. Change both."
    }
  ],
  "patterns": [
    {
      "glob": "lib/**/*.dart",
      "regex": "Widget\\s+_build\\w*\\(",
      "message": "Absolute rule 2: extract a StatelessWidget instead of a Widget _buildX() helper."
    },
    {
      "glob": "lib/**/*.dart",
      "regex": "Navigator\\.(of\\([^)]*\\)\\.)?push",
      "message": "Absolute rule 6: navigate with GoRouter (context.push / context.go). Raw Navigator pushes are only for dialog flows GoRouter can't express."
    },
    {
      "glob": "lib/pages/**/*.dart",
      "regex": "Color\\(0x",
      "message": "Absolute rule 7: use a design-system color token instead of a hardcoded Color(0x…)."
    },
    {
      "glob": "lib/widgets/**/*.dart",
      "regex": "Color\\(0x",
      "message": "Absolute rule 7: use a design-system color token instead of a hardcoded Color(0x…)."
    }
  ]
}
