{
  "$schema": "https://raw.githubusercontent.com/MaTeS72/agent-workflow-kit/main/schema/agent-workflow.schema.json",
  "stack": "flutter",
  "protected": [
    {
      "glob": "**/*.freezed.dart",
      "reason": "Generated by Freezed. Edit the source .dart file, then run `fvm dart run build_runner build --delete-conflicting-outputs`."
    },
    {
      "glob": "**/*.g.dart",
      "reason": "Generated by build_runner. Edit the source .dart file, then run `fvm dart run build_runner build --delete-conflicting-outputs`."
    },
    {
      "glob": "**/*.mocks.dart",
      "reason": "Generated by mockito. Change the @GenerateMocks annotation, then run build_runner."
    },
    {
      "glob": "lib/l10n/generated/**",
      "reason": "Generated by gen-l10n. Edit the ARB files in lib/l10n/, then run `fvm flutter gen-l10n`."
    }
  ],
  "formatOnEdit": [
    {
      "glob": "**/*.dart",
      "command": "fvm dart format {file}"
    }
  ],
  "pairedFiles": [
    {
      "glob": "lib/l10n/app_*.arb",
      "reminder": "ARB files change together: add the same key to every lib/l10n/app_*.arb file, then run `fvm flutter gen-l10n`."
    },
    {
      "glob": "pubspec.yaml",
      "reminder": "AGENTS.md rule: never add a dependency without asking. If you added one, stop and ask before going further."
    }
  ],
  "patterns": [
    {
      "glob": "lib/**/*.dart",
      "regex": "Widget\\s+_build\\w*\\(",
      "message": "Extract a StatelessWidget instead of a Widget _buildX() helper: it gets const support, its own element and a test seam."
    },
    {
      "glob": "lib/**/*.dart",
      "regex": "(?<![\\w.])print\\(",
      "message": "Use log() from dart:developer with a name: tag instead of print()."
    }
  ]
}
